4880000,愛知県,尾張旭市,,アイチケン,オワリアサヒシ,
4880083,愛知県,尾張旭市,旭ケ丘町旭ケ丘,アイチケン,オワリアサヒシ,アサヒガオカチョウアサヒガオカ
4880086,愛知県,尾張旭市,旭ケ丘町長洞,アイチケン,オワリアサヒシ,アサヒガオカチョウナガボラ
4880085,愛知県,尾張旭市,旭ケ丘町濁池,アイチケン,オワリアサヒシ,アサヒガオカチョウニゴリイケ
4880082,愛知県,尾張旭市,旭ケ丘町森,アイチケン,オワリアサヒシ,アサヒガオカチョウモリ
4880084,愛知県,尾張旭市,旭ケ丘町山の手,アイチケン,オワリアサヒシ,アサヒガオカチョウヤマノテ
4880001,愛知県,尾張旭市,旭台,アイチケン,オワリアサヒシ,アサヒダイ
4880855,愛知県,尾張旭市,旭前町,アイチケン,オワリアサヒシ,アサヒマエチョウ
4880852,愛知県,尾張旭市,旭前町新田洞,アイチケン,オワリアサヒシ,アサヒマエチョウシンデンボラ
4880854,愛知県,尾張旭市,旭前町西新田,アイチケン,オワリアサヒシ,アサヒマエチョウニシシンデン
4880851,愛知県,尾張旭市,旭前町北,アイチケン,オワリアサヒシ,アサヒマエチョウキタ
4880081,愛知県,尾張旭市,新居,アイチケン,オワリアサヒシ,アライ
4880079,愛知県,尾張旭市,新居町今池下,アイチケン,オワリアサヒシ,アライチョウイマイケシタ
4880073,愛知県,尾張旭市,新居町上の田,アイチケン,オワリアサヒシ,アライチョウカミノタ
4880075,愛知県,尾張旭市,新居町木の本,アイチケン,オワリアサヒシ,アライチョウキノモト
4880070,愛知県,尾張旭市,新居町五反田,アイチケン,オワリアサヒシ,アライチョウゴタンダ
4880071,愛知県,尾張旭市,新居町下切戸,アイチケン,オワリアサヒシ,アライチョウシモキリド
4880072,愛知県,尾張旭市,新居町諏訪南,アイチケン,オワリアサヒシ,アライチョウスワミナミ
4880078,愛知県,尾張旭市,新居町寺田,アイチケン,オワリアサヒシ,アライチョウテラダ
4880077,愛知県,尾張旭市,新居町西浦,アイチケン,オワリアサヒシ,アライチョウニシウラ
4880074,愛知県,尾張旭市,新居町明才切,アイチケン,オワリアサヒシ,アライチョウメイサイギリ
4880076,愛知県,尾張旭市,新居町山の田,アイチケン,オワリアサヒシ,アライチョウヤマノタ
4880024,愛知県,尾張旭市,井田町,アイチケン,オワリアサヒシ,イダチョウ
4880054,愛知県,尾張旭市,稲葉町,アイチケン,オワリアサヒシ,イナバチョウ
4880840,愛知県,尾張旭市,印場元町,アイチケン,オワリアサヒシ,インバモトチョウ
4880841,愛知県,尾張旭市,印場元町北山,アイチケン,オワリアサヒシ,インバモトチョウキタヤマ
4880843,愛知県,尾張旭市,印場元町細田,アイチケン,オワリアサヒシ,インバモトチョウホソダ
4880035,愛知県,尾張旭市,上の山町間口,アイチケン,オワリアサヒシ,ウエノヤマチョウマグチ
4880034,愛知県,尾張旭市,上の山町山畑,アイチケン,オワリアサヒシ,ウエノヤマチョウヤマハタ
4880004,愛知県,尾張旭市,大久手町一の曾,アイチケン,オワリアサヒシ,オオクテチョウイチノソウ
4880005,愛知県,尾張旭市,大久手町上切戸,アイチケン,オワリアサヒシ,オオクテチョウカミキリド
4880006,愛知県,尾張旭市,大久手町中松原,アイチケン,オワリアサヒシ,オオクテチョウナカマツバラ
4880826,愛知県,尾張旭市,大塚町,アイチケン,オワリアサヒシ,オオツカチョウ
4880008,愛知県,尾張旭市,柏井町弥栄,アイチケン,オワリアサヒシ,カシワイチョウイヤサカ
4880007,愛知県,尾張旭市,柏井町公園通,アイチケン,オワリアサヒシ,カシワイチョウコウエンドオリ
4880846,愛知県,尾張旭市,霞ケ丘町中,アイチケン,オワリアサヒシ,カスミガオカチョウナカ
4880845,愛知県,尾張旭市,霞ケ丘町南,アイチケン,オワリアサヒシ,カスミガオカチョウミナミ
4880847,愛知県,尾張旭市,霞ケ丘町北,アイチケン,オワリアサヒシ,カスミガオカチョウキタ
4880022,愛知県,尾張旭市,狩宿新町,アイチケン,オワリアサヒシ,カリジュクシンチョウ
4880021,愛知県,尾張旭市,狩宿町,アイチケン,オワリアサヒシ,カリジュクチョウ
4880065,愛知県,尾張旭市,北原山町大久保見,アイチケン,オワリアサヒシ,キタハラヤマチョウオオクボミ
4880063,愛知県,尾張旭市,北原山町陀摩屋敷,アイチケン,オワリアサヒシ,キタハラヤマチョウダマヤシキ
4880064,愛知県,尾張旭市,北原山町鳴湫,アイチケン,オワリアサヒシ,キタハラヤマチョウナルクテ
4880062,愛知県,尾張旭市,北原山町平池浦,アイチケン,オワリアサヒシ,キタハラヤマチョウヒライケウラ
4880061,愛知県,尾張旭市,北原山町六田池,アイチケン,オワリアサヒシ,キタハラヤマチョウムタイケ
4880043,愛知県,尾張旭市,北本地ケ原町,アイチケン,オワリアサヒシ,キタホンジガハラチョウ
4880057,愛知県,尾張旭市,北山町北新田,アイチケン,オワリアサヒシ,キタヤマチョウキタシンデン
4880056,愛知県,尾張旭市,北山町北山,アイチケン,オワリアサヒシ,キタヤマチョウキタヤマ
4880055,愛知県,尾張旭市,北山町六反田,アイチケン,オワリアサヒシ,キタヤマチョウロクタンダ
4880859,愛知県,尾張旭市,桜ケ丘町,アイチケン,オワリアサヒシ,サクラガオカチョウ
4880857,愛知県,尾張旭市,桜ケ丘町西,アイチケン,オワリアサヒシ,サクラガオカチョウニシ
4880015,愛知県,尾張旭市,三郷町栄,アイチケン,オワリアサヒシ,サンゴウチョウサカエ
4880012,愛知県,尾張旭市,三郷町角田,アイチケン,オワリアサヒシ,サンゴウチョウツノダ
4880016,愛知県,尾張旭市,三郷町陶栄,アイチケン,オワリアサヒシ,サンゴウチョウトウエイ
4880013,愛知県,尾張旭市,三郷町富丘,アイチケン,オワリアサヒシ,サンゴウチョウトミオカ
4880014,愛知県,尾張旭市,三郷町中井田,アイチケン,オワリアサヒシ,サンゴウチョウナカイダ
4880839,愛知県,尾張旭市,渋川町,アイチケン,オワリアサヒシ,シブカワチョウ
4880052,愛知県,尾張旭市,下井町下井,アイチケン,オワリアサヒシ,シモイチョウシモイ
4880053,愛知県,尾張旭市,下井町刎内,アイチケン,オワリアサヒシ,シモイチョウハネウチ
4880051,愛知県,尾張旭市,下井町前の上,アイチケン,オワリアサヒシ,シモイチョウマエノカミ
4880838,愛知県,尾張旭市,庄中町,アイチケン,オワリアサヒシ,ショウナカチョウ
4880836,愛知県,尾張旭市,庄中町渋川,アイチケン,オワリアサヒシ,ショウナカチョウシブカワ
4880835,愛知県,尾張旭市,庄中町南島,アイチケン,オワリアサヒシ,ショウナカチョウミナミジマ
4880823,愛知県,尾張旭市,庄南町,アイチケン,オワリアサヒシ,ショウナンチョウ
4880867,愛知県,尾張旭市,城前町,アイチケン,オワリアサヒシ,シロマエチョウ
4880863,愛知県,尾張旭市,城前町上大道,アイチケン,オワリアサヒシ,シロマエチョウカミダイドウ
4880861,愛知県,尾張旭市,城前町城前,アイチケン,オワリアサヒシ,シロマエチョウシロマエ
4880866,愛知県,尾張旭市,城前町茅池,アイチケン,オワリアサヒシ,シロマエチョウチガイケ
4880884,愛知県,尾張旭市,城山町城山,アイチケン,オワリアサヒシ,シロヤマチョウシロヤマ
4880883,愛知県,尾張旭市,城山町長池下,アイチケン,オワリアサヒシ,シロヤマチョウナガイケシモ
4880881,愛知県,尾張旭市,城山町三ツ池,アイチケン,オワリアサヒシ,シロヤマチョウミツイケ
4880882,愛知県,尾張旭市,城山町向ケ丘,アイチケン,オワリアサヒシ,シロヤマチョウムコウガオカ
4880023,愛知県,尾張旭市,瀬戸川町,アイチケン,オワリアサヒシ,セトガワチョウ
4880011,愛知県,尾張旭市,東栄町,アイチケン,オワリアサヒシ,トウエイチョウ
4880844,愛知県,尾張旭市,東名西町,アイチケン,オワリアサヒシ,トウメイニシチョウ
4880821,愛知県,尾張旭市,長坂町南山,アイチケン,オワリアサヒシ,ナガサカチョウミナミヤマ
4880813,愛知県,尾張旭市,西大道町五輪塚,アイチケン,オワリアサヒシ,ニシダイドウチョウゴリンヅカ
4880816,愛知県,尾張旭市,西大道町下大道,アイチケン,オワリアサヒシ,ニシダイドウチョウシモダイドウ
4880814,愛知県,尾張旭市,西大道町前田,アイチケン,オワリアサヒシ,ニシダイドウチョウマエダ
4880817,愛知県,尾張旭市,西大道町八瀬の木前,アイチケン,オワリアサヒシ,ニシダイドウチョウヤセノキマエ
4880815,愛知県,尾張旭市,西大道町六兵衛前,アイチケン,オワリアサヒシ,ニシダイドウチョウロクベエマエ
4880804,愛知県,尾張旭市,西の野町,アイチケン,オワリアサヒシ,ニシノノチョウ
4880805,愛知県,尾張旭市,西の野町豆塚,アイチケン,オワリアサヒシ,ニシノノチョウマメヅカ
4880824,愛知県,尾張旭市,西山町,アイチケン,オワリアサヒシ,ニシヤマチョウ
4880002,愛知県,尾張旭市,根の鼻町,アイチケン,オワリアサヒシ,ネノハナチョウ
4880858,愛知県,尾張旭市,白鳳町,アイチケン,オワリアサヒシ,ハクホウチョウ
4880032,愛知県,尾張旭市,晴丘町池上,アイチケン,オワリアサヒシ,ハルオカチョウイケガミ
4880031,愛知県,尾張旭市,晴丘町東,アイチケン,オワリアサヒシ,ハルオカチョウヒガシ
4880830,愛知県,尾張旭市,東印場町,アイチケン,オワリアサヒシ,ヒガシインバチョウ
4880833,愛知県,尾張旭市,東印場町二反田,アイチケン,オワリアサヒシ,ヒガシインバチョウニタンダ
4880003,愛知県,尾張旭市,東大久手町,アイチケン,オワリアサヒシ,ヒガシオオクテチョウ
4880017,愛知県,尾張旭市,東三郷町,アイチケン,オワリアサヒシ,ヒガシサンゴウチョウ
4880802,愛知県,尾張旭市,東大道町曽我廻間,アイチケン,オワリアサヒシ,ヒガシダイドウチョウソガサマ
4880801,愛知県,尾張旭市,東大道町原田,アイチケン,オワリアサヒシ,ヒガシダイドウチョウハラタ
4880803,愛知県,尾張旭市,東大道町山の内,アイチケン,オワリアサヒシ,ヒガシダイドウチョウヤマノウチ
4880033,愛知県,尾張旭市,東本地ケ原町,アイチケン,オワリアサヒシ,ヒガシホンジガハラチョウ
4880825,愛知県,尾張旭市,東山町,アイチケン,オワリアサヒシ,ヒガシヤマチョウ
4880876,愛知県,尾張旭市,平子ケ丘町,アイチケン,オワリアサヒシ,ヒラコガオカチョウ
4880873,愛知県,尾張旭市,平子町中通,アイチケン,オワリアサヒシ,ヒラコチョウナカドオリ
4880872,愛知県,尾張旭市,平子町長池上,アイチケン,オワリアサヒシ,ヒラコチョウナガイケカミ
4880871,愛知県,尾張旭市,平子町東,アイチケン,オワリアサヒシ,ヒラコチョウヒガシ
4880874,愛知県,尾張旭市,平子町西,アイチケン,オワリアサヒシ,ヒラコチョウニシ
4880875,愛知県,尾張旭市,平子町北,アイチケン,オワリアサヒシ,ヒラコチョウキタ
4880822,愛知県,尾張旭市,緑町緑ケ丘,アイチケン,オワリアサヒシ,ミドリチョウミドリガオカ
4880045,愛知県,尾張旭市,南栄町,アイチケン,オワリアサヒシ,ミナミサカエチョウ
4880046,愛知県,尾張旭市,南栄町旭ケ丘,アイチケン,オワリアサヒシ,ミナミサカエチョウアサヒガオカ
4880047,愛知県,尾張旭市,南栄町黒石,アイチケン,オワリアサヒシ,ミナミサカエチョウクロイシ
4880041,愛知県,尾張旭市,南新町中畑,アイチケン,オワリアサヒシ,ミナミシンチョウナカハタ
4880042,愛知県,尾張旭市,南新町白山,アイチケン,オワリアサヒシ,ミナミシンチョウハクサン
4880066,愛知県,尾張旭市,南原山町赤土,アイチケン,オワリアサヒシ,ミナミハラヤマチョウアカツチ
4880067,愛知県,尾張旭市,南原山町石原,アイチケン,オワリアサヒシ,ミナミハラヤマチョウイシハラ
4880068,愛知県,尾張旭市,南原山町南原山,アイチケン,オワリアサヒシ,ミナミハラヤマチョウミナミハラヤマ
4880044,愛知県,尾張旭市,南本地ケ原町,アイチケン,オワリアサヒシ,ミナミホンジガハラチョウ
4880818,愛知県,尾張旭市,向町,アイチケン,オワリアサヒシ,ムカエチョウ
4880827,愛知県,尾張旭市,吉岡町,アイチケン,オワリアサヒシ,ヨシオカチョウ
4888555,愛知県,尾張旭市,大字新居５１８２−１,アイチケン,オワリアサヒシ,
4888688,愛知県,尾張旭市,旭前町５０５０,アイチケン,オワリアサヒシ,
4888655,愛知県,尾張旭市,旭前町新田洞５０５０番地の１,アイチケン,オワリアサヒシ,
4888666,愛知県,尾張旭市,東大道町原田２６００−１,アイチケン,オワリアサヒシ,
4888578,愛知県,尾張旭市,下井町刎内２３４５−１,アイチケン,オワリアサヒシ,
4888686,愛知県,尾張旭市,狩宿新町１丁目１番地１,アイチケン,オワリアサヒシ,
4888585,愛知県,尾張旭市,平子町北６１番地,アイチケン,オワリアサヒシ,
4888520,愛知県,尾張旭市,三郷町角田１１２３番地,アイチケン,オワリアサヒシ,
4888501,愛知県,尾張旭市,晴丘町池上１番地,アイチケン,オワリアサヒシ,
